{"expected_text_sha256":"3beb67835a0c2b4fe21a2b3b8d90fd84cce0f0ca2b01a5759c8409890b781e94","extraction":{"extractor":{"code_sha256":"8460754d64e3c798cafc851762ea3008b9272cc1cb1210cd9c87b36304be6e17","name":"rcwh-extraction","package_version":"1.27.2.3","python":"CPython 3.12.13","version":1},"input":{"asset_ref":"asset:primary:hlm:zhihui:v3.1416:pdf","sha256":"37441da3cb438d1b3eab2b511aa6f1695f309192fa63bea842413ff91655c1d7"},"manifest_ref":"asset:sha256:e3fae3441a9593750b51ead034891d2295360a046816b6d2b59cd46c07d331f7","manifest_sha256":"e3fae3441a9593750b51ead034891d2295360a046816b6d2b59cd46c07d331f7","output":{"asset_ref":"asset:sha256:628f2e057a93f48dfdf326e8ba1bfecea1fd2b30f418314046842b8bf46c8920","bytes":41001,"sha256":"628f2e057a93f48dfdf326e8ba1bfecea1fd2b30f418314046842b8bf46c8920"}},"findings":[],"locator_sha256":"95bb80edf330f501de630ebc805995b88cb5ccb7b1d628d91e158971e9582d3a","raw_excerpt":"与后文“落叶萧萧，寒烟漠漠”一对，可伤可叹！","raw_text_sha256":"3beb67835a0c2b4fe21a2b3b8d90fd84cce0f0ca2b01a5759c8409890b781e94","schema_version":1,"source_id":"src:jiaxu:ch26:falling-leaves-cold-smoke","source_record_sha256":"f15cc0ab170197ea8b0cddab32637337650362f2bcb37e0feec7ad712ad50165","status":"PASS","verifier":{"code_sha256":"8388a52605f5915b1a66ca6c60c7e01e68d49ea851788ad98b1af478c8d023e0","name":"rcwh-source-locator","version":1}}
