{"expected_text_sha256":"53e9608a793b9b1be1bf5876a6996f817779cbed964cb477150c13cc20812e87","extraction":{"extractor":{"code_sha256":"8460754d64e3c798cafc851762ea3008b9272cc1cb1210cd9c87b36304be6e17","name":"rcwh-extraction","package_version":null,"python":"CPython 3.12.13","version":1},"input":{"asset_ref":"asset:sha256:ed674f0c11e4debd80da22f139d8e1c15c902cc59e35c8e6d51e0ff00e94860a","sha256":"ed674f0c11e4debd80da22f139d8e1c15c902cc59e35c8e6d51e0ff00e94860a"},"manifest_ref":"asset:sha256:db49ea971dd06c998a4e8b108a6dff43cb5a4b3e91384c7654d1363842286522","manifest_sha256":"db49ea971dd06c998a4e8b108a6dff43cb5a4b3e91384c7654d1363842286522","output":{"asset_ref":"asset:sha256:999effc20a431c68d28b9378eee31ce492e9a57e9b985f25ff2a7388adf9c11c","bytes":2169,"sha256":"999effc20a431c68d28b9378eee31ce492e9a57e9b985f25ff2a7388adf9c11c"}},"findings":[],"locator_sha256":"5734c8cd5fc2c72205f0029f8252f5c482ecedb87060f7702f660e7ed8892042","raw_excerpt":"總督范時繹已將曹頫家管事數人拿去夾訊監禁所有房產什物一併查清造冊封固","raw_text_sha256":"53e9608a793b9b1be1bf5876a6996f817779cbed964cb477150c13cc20812e87","schema_version":1,"source_id":"src:history:cao:1728:inventory-seal","source_record_sha256":"48884ba83e41c57b754aa31a25b1962fc7e1070340302a69efc97d42e4184306","status":"PASS","verifier":{"code_sha256":"8388a52605f5915b1a66ca6c60c7e01e68d49ea851788ad98b1af478c8d023e0","name":"rcwh-source-locator","version":1}}
